<?xml version="1.0" encoding="utf-8"?>
<!--
  ~ Artifactory is a binaries repository manager.
  ~ Copyright (C) 2012 JFrog Ltd.
  ~
  ~ Artifactory is free software: you can redistribute it and/or modify
  ~ it under the terms of the GNU Lesser General Public License as published by
  ~ the Free Software Foundation, either version 3 of the License, or
  ~ (at your option) any later version.
  ~
  ~ Artifactory is distributed in the hope that it will be useful,
  ~ but WITHOUT ANY WARRANTY; without even the implied warranty of
  ~ MERCHANTABILITY or FITNESS FOR A PARTICULAR PURPOSE.  See the
  ~ GNU Lesser General Public License for more details.
  ~
  ~ You should have received a copy of the GNU Lesser General Public License
  ~ along with Artifactory.  If not, see <http://www.gnu.org/licenses/>.
  -->

<xs:schema xmlns:xs="http://www.w3.org/2001/XMLSchema" version="1.0"
           targetNamespace="http://artifactory.jfrog.org/xsd/1.0.0"
           xmlns="http://artifactory.jfrog.org/xsd/1.0.0"
           elementFormDefault="qualified">

    <xs:element name="config" type="CentralConfigType"/>

    <xs:complexType name="CentralConfigType">
        <xs:sequence>
            <xs:element name="serverName" type="xs:string" minOccurs="0">
                <xs:annotation>
                    <xs:documentation source="description">
                        <![CDATA[
                        A name uniquely identifying this artifactory server instance accross the
                        network.
                        ]]>
                    </xs:documentation>
                </xs:annotation>
            </xs:element>
            <xs:element name="anonDownloadsAllowed" type="xs:boolean" minOccurs="0" default="true">
                <xs:annotation>
                    <xs:documentation source="description">
                        Determines whether anonymous downloads are permitted.
                    </xs:documentation>
                </xs:annotation>
            </xs:element>
            <xs:element name="backupDir" type="xs:string" minOccurs="0">
                <xs:annotation>
                    <xs:documentation source="description">
                        <![CDATA[
                        The directory to which backup local repository data as files.
                        ]]>
                    </xs:documentation>
                </xs:annotation>
            </xs:element>
            <xs:element name="backupCronExp" type="xs:string" minOccurs="0">
                <xs:annotation>
                    <xs:documentation source="description">
                        <![CDATA[
                        The cron expression by which backup frequency is determined.
                        ]]>
                    </xs:documentation>
                </xs:annotation>
            </xs:element>
            <xs:element name="dateFormat" type="xs:string" default="dd-MM-yy HH:mm:ssZ"
                        minOccurs="0">
                <xs:annotation>
                    <xs:documentation source="description">
                        The format used for displaying dates.
                    </xs:documentation>
                </xs:annotation>
            </xs:element>
            <xs:element name="localRepositories" type="LocalRepositoriesType">
                <xs:annotation>
                    <xs:documentation source="description">
                        A set of locally installed repositories.
                    </xs:documentation>
                </xs:annotation>
            </xs:element>
            <xs:element name="remoteRepositories" type="RemoteRepositoriesType" minOccurs="0">
                <xs:annotation>
                    <xs:documentation source="description">
                        A set of remote proxied (normally cached) repositories.
                    </xs:documentation>
                </xs:annotation>
            </xs:element>
            <xs:element name="proxies" minOccurs="0">
                <xs:annotation>
                    <xs:documentation source="description">
                        A set of reusable proxy definitions.
                    </xs:documentation>
                </xs:annotation>
                <xs:complexType>
                    <xs:sequence>
                        <xs:element name="proxy" type="ProxyType" maxOccurs="unbounded"
                                    minOccurs="0"/>
                    </xs:sequence>
                </xs:complexType>
            </xs:element>
        </xs:sequence>
    </xs:complexType>

    <xs:complexType name="LocalRepositoriesType">
        <xs:sequence>
            <xs:element name="localRepository" type="LocalRepoType" maxOccurs="unbounded"/>
        </xs:sequence>
    </xs:complexType>

    <xs:complexType name="LocalRepoType">
        <xs:complexContent>
            <xs:extension base="RepoType">
                <xs:sequence>
                    <xs:element name="useSnapshotUniqueVersions" type="xs:boolean" default="false"
                                minOccurs="0">
                        <xs:annotation>
                            <xs:documentation source="description">
                                Whether to use time-based version numbers for the name of SNAPSHOTs,
                                or to use a self-overridding artifactId-version-SNAPSHOT.type
                                naming.
                            </xs:documentation>
                        </xs:annotation>
                    </xs:element>
                </xs:sequence>
            </xs:extension>
        </xs:complexContent>
    </xs:complexType>

    <xs:complexType name="RepoType" abstract="true">
        <xs:sequence>
            <xs:element name="key" type="xs:string">
                <xs:annotation>
                    <xs:documentation source="description">
                        Repository unique id.
                    </xs:documentation>
                </xs:annotation>
            </xs:element>
            <xs:element name="description" type="xs:string" default="default description"
                        minOccurs="0">
                <xs:annotation>
                    <xs:documentation source="description">
                        Textual description of the repository.
                    </xs:documentation>
                </xs:annotation>
            </xs:element>
            <xs:element name="blackedOut" type="xs:boolean" default="false" minOccurs="0">
                <xs:annotation>
                    <xs:documentation source="description">
                        Whether the repository is blacked-out. A blacked-out repository does not
                        participate in artifact resolution, nor dies its local cache.
                    </xs:documentation>
                </xs:annotation>
            </xs:element>
            <xs:element name="handleReleases" type="xs:boolean" default="true" minOccurs="0">
                <xs:annotation>
                    <xs:documentation source="description">
                        Whether the repository handle release artifacts.
                    </xs:documentation>
                </xs:annotation>
            </xs:element>
            <xs:element name="handleSnapshots" type="xs:boolean" default="true" minOccurs="0">
                <xs:annotation>
                    <xs:documentation source="description">
                        Whether the repository handle snapshot artifacts.
                    </xs:documentation>
                </xs:annotation>
            </xs:element>
            <xs:element name="includesPattern" type="xs:string" minOccurs="0">
                <xs:annotation>
                    <xs:documentation source="description">
                        A comma-separated list of artifact patterns to include when evaluating
                        artifact requests, in the form of x/y/**/z/*. When used, only requests
                        matching one the include patterns will be served.
                        By default all artifacts are included (**/*).
                    </xs:documentation>
                </xs:annotation>
            </xs:element>
            <xs:element name="excludesPattern" type="xs:string" minOccurs="0">
                <xs:annotation>
                    <xs:documentation source="description">
                        A comma-separated list of artifact patterns to exclude when evaluating
                        artifact requests, in the form of x/y/**/z/*.
                        By default no artifacts are excluded.
                    </xs:documentation>
                </xs:annotation>
            </xs:element>
        </xs:sequence>
    </xs:complexType>

    <xs:complexType name="RemoteRepositoriesType">
        <xs:sequence>
            <xs:element name="remoteRepository" type="RemoteRepoType" maxOccurs="unbounded"/>
        </xs:sequence>
    </xs:complexType>

    <xs:complexType name="RepoType">
        <xs:complexContent>
            <xs:extension base="RemoteRepoBaseType">
                <xs:sequence>
                    <xs:element name="username" type="xs:string" minOccurs="0">
                        <xs:annotation>
                            <xs:documentation source="description">
                                HTTP authentication username.
                            </xs:documentation>
                        </xs:annotation>
                    </xs:element>
                    <xs:element name="password" type="xs:string" minOccurs="0">
                        <xs:annotation>
                            <xs:documentation source="description">
                                HTTP authentication password.
                            </xs:documentation>
                        </xs:annotation>
                    </xs:element>
                    <xs:element name="socketTimeoutMillis" type="xs:int" default="5000"
                                minOccurs="0">
                        <xs:annotation>
                            <xs:documentation source="description">
                                Network timeout in milliseconds to use both for connection
                                establishment and for unanswered requests.
                                Timing out is considered a retrieval failure.
                            </xs:documentation>
                        </xs:annotation>
                    </xs:element>
                    <xs:element name="proxyRef" type="xs:IDREF" minOccurs="0">
                        <xs:annotation>
                            <xs:documentation source="description">
                                Network proxy reference.
                            </xs:documentation>
                        </xs:annotation>
                    </xs:element>
                </xs:sequence>
            </xs:extension>
        </xs:complexContent>
    </xs:complexType>

    <xs:complexType name="RemoteRepoBaseType" abstract="true">
        <xs:complexContent>
            <xs:extension base="RepoType">
                <xs:sequence>
                    <xs:element name="url" type="xs:string">
                        <xs:annotation>
                            <xs:documentation source="description">
                                The url for the remote repository. Currently only HTTP urls are
                                supported.
                            </xs:documentation>
                        </xs:annotation>
                    </xs:element>
                    <xs:element name="hardFail" type="xs:boolean" default="false" minOccurs="0">
                        <xs:annotation>
                            <xs:documentation source="description">
                                Whether failing to communicate with this repository will return an
                                error to the client that will fail the build.
                            </xs:documentation>
                        </xs:annotation>
                    </xs:element>
                    <xs:element name="storeArtifactsLocally" type="xs:boolean" default="true"
                                minOccurs="0">
                        <xs:annotation>
                            <xs:documentation source="description">
                                Whether the repository should cache artifacts locally. Leave as
                                'true', as direct-to-client streaming has not been tested.
                            </xs:documentation>
                        </xs:annotation>
                    </xs:element>
                    <xs:element name="retrievalCachePeriodSecs" type="xs:long" default="43200"
                                minOccurs="0">
                        <xs:annotation>
                            <xs:documentation source="description">
                                The number of seconds to cache artifact lookup results.
                                A value of 0 means no caching.
                            </xs:documentation>
                        </xs:annotation>
                    </xs:element>

                    <xs:element name="failedRetrievalCachePeriodSecs" type="xs:long" default="30"
                                minOccurs="0">
                        <xs:annotation>
                            <xs:documentation source="description">
                                The number of seconds to cache artifact retrieval failures
                                (resulting in comm. errors).
                                A value of 0 means no caching.
                            </xs:documentation>
                        </xs:annotation>
                    </xs:element>
                    <xs:element name="missedRetrievalCachePeriodSecs" type="xs:long" default="43200"
                                minOccurs="0">
                        <xs:annotation>
                            <xs:documentation source="description">
                                The number of seconds to cache artifact retrieval misses (artifct
                                not found).
                                A value of 0 means no caching.
                            </xs:documentation>
                        </xs:annotation>
                    </xs:element>
                </xs:sequence>
            </xs:extension>
        </xs:complexContent>
    </xs:complexType>

    <xs:complexType name="ProxyType">
        <xs:sequence>
            <xs:element name="key" type="xs:ID">
                <xs:annotation>
                    <xs:documentation source="description">
                        Proxy unique id.
                    </xs:documentation>
                </xs:annotation>
            </xs:element>
            <xs:element name="host" type="xs:string">
                <xs:annotation>
                    <xs:documentation source="description">
                        Proxy host.
                    </xs:documentation>
                </xs:annotation>
            </xs:element>
            <xs:element name="port" type="xs:int">
                <xs:annotation>
                    <xs:documentation source="description">
                        Proxy port number.
                    </xs:documentation>
                </xs:annotation>
            </xs:element>
            <xs:element name="username" type="xs:string" minOccurs="0">
                <xs:annotation>
                    <xs:documentation source="description">
                        Proxy username.
                    </xs:documentation>
                </xs:annotation>
            </xs:element>
            <xs:element name="password" type="xs:string" minOccurs="0">
                <xs:annotation>
                    <xs:documentation source="description">
                        Proxy password.
                    </xs:documentation>
                </xs:annotation>
            </xs:element>
            <xs:element name="domain" type="xs:string" minOccurs="0">
                <xs:annotation>
                    <xs:documentation source="description">
                        Proxy domain/realm name.
                    </xs:documentation>
                </xs:annotation>
            </xs:element>
        </xs:sequence>
    </xs:complexType>
</xs:schema>